Row ID ,Comment,Aspect Ranks,,,,,,,Aspects,,,,,,,Sentiment
6628,The instructor's method to motivate towards subject is good.,4,5,5,4,5,5,5,0,0,1,0,0,0,0,4
6629,"Overall he is good and is trying his level best , but he is not so good at giving examples; I think he can come up with practical application or videos which can  demonstrate concepts. So, in this way, we can make our learning process more profitable.",4,5,4,4,4,5,4,0,1,0,1,0,0,1,3
6630,"Sir should teach us by coming to our level and not at his doctoral level. Sir always used to say (you have read that). Sir, even if we have read it in lower classes,  you have to tell something about that to clear the picture of the topic in our mind.",4,4,3,3,4,4,3,0,0,1,0,0,0,1,2
6636,The instructor has good driving skills and drives pretty good. He can be a good social science teacher as he has great knowledge about social science.,4,5,3,4,3,4,4,0,1,0,0,0,0,0,4
6639,He needs to improve his conveyance method and his grip over the module. He does not seem to be good at motivating students towards the module.,3,3,2,3,3,3,2,0,1,1,0,0,0,1,2
6640,He's polite and tries to understand the things.,4,5,3,3,4,4,3,0,0,0,0,0,0,1,4
6650,The instructor's method of teaching is good.,5,5,5,5,5,0,0,0,0,0,0,0,0,1,4
6651,"HE IS QUITE HELPFUL .IF WE ARE STRUCK SOMEWHERE, HE TRIES TO SOLVE OUR PROBLEMs.",4,4,4,4,4,0,0,0,0,0,0,0,1,0,4
6652,The instructor should be little bit more cooperative.,3,4,3,4,3,0,0,0,0,0,0,0,0,0,2
6653,"The apparatus should be increased in number as some groups have to stand outside and wait for their turn. So if there is sufficient number of apparatus, then there would be no time-wastage.",4,4,4,4,3,0,0,0,0,0,0,0,1,0,2
6658,Sir is good and cooperative  and guides the students fully.,4,4,4,3,3,0,0,0,1,0,0,0,0,1,4
6659,He is a friendly human being. He tries his best to make the students understand the lecture.,4,5,3,4,4,0,0,0,1,0,0,0,0,1,4
6661,Sir is very friendly and helps students in lab for solving problem of particular topic.,4,5,5,4,5,0,0,0,0,0,0,0,1,0,4
6662,Both the teachers seem like they are my elder brothers and they never hesitate to help me whenever I call them. They motivate us to do practicals in a brotherly way and  I am quit satisfied with the way they create the atmosphere.,5,5,5,5,5,0,0,0,0,0,0,0,0,1,4
6663,"He's cooperative, teaches students without any hesitation and has a firm grip over his module.",5,4,4,4,4,0,0,0,1,0,0,0,0,1,4
6673,The instructor's method to teach is excellent.,5,5,5,5,5,5,0,0,0,0,0,0,0,1,5
6674,The instructor should not give these big readings.,5,4,4,3,3,4,0,0,0,0,0,0,0,0,2
6675,"The chapters which are given to us are of doctorate level, so sir has the clear theme of every chapter before assignment and not after the assignment.",4,5,4,5,4,5,0,0,0,0,0,0,0,0,2
6676,Assignments are too much because of which we could not pay attention to other subjects properly,3,4,4,3,3,3,0,0,0,0,0,0,0,0,2
6677,Assignments are more than limited... ,4,3,3,3,3,3,0,0,0,0,0,0,0,0,3
6680,"Everything should be improved and needs to be. They should teach us some real deal. If the instructors want to teach us something related to historical aspects, then they should arrange trips rather than giving us bulky materials to read. Visually, people learn quickly and do not get bored.",3,3,3,3,2,3,0,1,1,1,1,1,1,1,1
6681,"Sir should improve the teaching method and make a power point presentation which includes pictures and movies related to topic. In this way we can understand better. Also, sir should involve every student in class. Only a few students speak again and again and all the remaining do not listen attentively",3,3,2,2,3,2,0,0,0,0,0,0,0,1,2
6682,He is a good human being. He treats all the students with equality.,5,5,4,4,4,4,0,0,0,0,0,0,0,1,4
6683,The course should be taught equal to the level of the students. Too much higher things are taught e.g. Philosophy,3,5,3,4,4,4,0,0,0,0,1,0,0,1,1
6684,The instructor's technique to try to relate philosophy  to us is good.,3,4,3,3,3,3,0,0,0,1,1,0,0,1,4
6686,"The first which is quite necessary is that the write-ups we get should be written in easy manner which would make it possible for us to understand them because we get discouraged when we try to read single page again and again and at last we don't get anything . Second thing: if you are giving such write- ups, you should give us the lectures on them first so it would be quite easy for us to understand them. We give answers according to our own assumptions before the lecture and we get marks according to that . So what is the purpose of having the lecture after write-up? ",5,4,3,4,3,2,0,0,0,0,0,0,0,1,2
6695,Every thing is perfect.,5,5,5,5,5,5,0,1,1,1,1,1,1,1,5
6700,"The instructor took us to the trip to show us the visual arts and there are other activities like clay painting, so it is good.",2,4,4,4,5,4,0,0,0,1,1,0,0,1,4
6701,The instructor should clarify the topic more. She goes fast while teaching.,3,4,4,3,4,4,0,0,0,0,0,0,0,1,2
6702,"Everything should be improved. The instructors should teach us some real deal. If they want to teach us something related to history, then they should arrange trips rather then giving us bulky materials to read because visual knowledge is more important than reading.",3,4,2,3,2,4,0,0,1,1,1,0,0,1,1
6705,The instructor is very friendly and cooperative with students.,4,3,4,3,4,3,0,0,0,0,0,0,0,1,4
6706,The instructor should include more activities.,3,4,4,4,4,4,0,0,0,0,0,0,0,1,2
6722,The instructor cannot focus exactly on the topic being taught. He usually gets diverted from the topic.,3,5,5,5,5,5,0,0,0,0,0,0,0,1,1
6725,We do not know what we have learned. Tutor teaches us just the history of the subject.,3,3,3,3,3,2,0,0,0,1,0,1,0,1,2
6727,In class we have just slides. Slides have only theories; there are too much slides with little information. We are only studying definitions.,3,4,3,3,3,3,0,0,1,1,1,0,0,1,1
6739,Sir is very punctual. Excellent preparation of course content,5,4,4,4,4,4,0,0,1,0,0,0,0,1,5
6747,"It's difficult for us to revise the content covered during lecture. So, there should be notes/slides (may be).",4,4,5,4,5,5,3,0,0,0,0,0,0,0,3
6748,The instructor tries to keep the interest of students in module.,3,4,4,5,3,5,3,0,0,1,0,0,0,1,4
6754,All is well.,5,3,5,4,4,5,5,1,1,1,1,1,1,1,4
6758,"It is a whole new thing for us, so I think we should be treated like a beginner at first. I would request if sir can repeat the topics with a little detail and step by step, hopefully, we will start getting the contents of the course. ",4,5,4,4,4,4,4,0,1,1,0,0,0,1,3
6761,We are determined to do his tasks.,3,5,5,1,4,5,5,0,0,1,0,0,0,0,5
6762,Lab's solution should be discussed in class. ,3,4,4,4,4,3,4,0,0,0,0,0,1,0,3
6765,"The instructor should give practical problems for students to solve. The instructor should increase the deadline of course work by a few days, please!",3,5,4,5,4,4,4,0,0,0,1,0,0,0,2
6776,He should get married.,5,5,5,5,5,5,0,0,0,0,0,0,0,0,1
6783,He has complete grip on course and also has knowledge about adherence things. He is completely honest with subject. The best part is that he tries that every student should learn some thing. He is not like some teachers who only concentrate on intelligent students who go with them for whole module. Giving hard notes is one of the best thing which is  very much helpful for preparation.,5,5,5,5,5,5,0,0,1,1,0,1,0,1,5
6801,He should arrange a grand party of his marriage for us.,5,5,5,5,5,0,0,0,0,0,0,0,0,0,3
6817,He has good knowledge but the teaching method/ conveying the topic is not good.,5,4,3,3,5,3,0,0,1,0,0,0,0,1,3
6830,Method of teaching is very good :),5,5,5,5,5,5,0,0,0,0,0,0,0,1,5
6833,The instructor's teaching methodology is quite attractive and practical examples help a lot plus the experience of the instructor ,5,5,5,5,5,5,0,0,1,0,1,0,0,1,5
6844,"The instructor's method of teaching is very good. Ma'am, you are great :)",5,5,5,5,5,5,0,0,0,0,0,0,0,1,5
6863,"THE TEACHER SHOULD TELL MORE ABOUT THE PAPER PATTERN...LIKE STILL I DON'T KNOW WHAT IS GOING TO BE THE PAPER PATTERN. FOR THAT, TEACHER SHOULD GIVE A DETAILED LECTURE.",5,4,4,4,3,3,0,0,0,0,0,1,0,0,3
6865,Course should focus more towards real life examples.,5,2,3,2,4,4,0,0,0,0,1,0,0,0,2
6869,The instructor should do one example in the class and give some questions to students for practice.,5,4,4,4,4,3,0,0,0,0,0,0,0,1,3
6870,"Although the course which is being taught us is not so difficult, but the method of teaching is not so satisfactory, which means that if  today we study Quadratic equations , we study it again after many days. Nothing is completed properly. So it is my humble request to improve it.",2,4,3,4,2,2,0,0,0,0,0,1,0,1,2
6872,Class environment should be active and energetic so that students do not sleep mentally.,4,4,3,5,4,4,0,0,0,1,0,0,0,1,2
6873,The instructor should give some questions to the students for practice.,4,3,4,3,4,4,0,0,0,0,0,0,0,0,3
6875,"The instructor has been focusing on graphing that is because in our education, we do not have more knowledge about graphing, and understanding of graphing is essential in our life. I think that the instructor should focus a bit more on word problems which are also used in our daily life.",4,4,5,3,3,4,0,0,0,0,1,0,0,1,4
6885,He should try not to get angry.,5,4,4,4,4,4,0,0,0,0,0,0,0,0,2
6889,"Instructor needs to be true and needs to answer the questions with patience, regard and care of others' point of view and with respect",4,3,2,3,3,3,0,0,0,0,0,0,0,1,1
6891,He interacts with all students and allows them to speak.,5,5,5,4,4,5,0,0,0,0,0,0,0,1,4
6892, This course is essential to teach me how to live in a society and improve it.,5,5,5,3,4,3,0,0,0,1,1,0,0,1,5
6903,"No matter what, we always have to speak in English during class.",4,5,5,4,4,4,0,0,0,0,0,0,0,1,3
6904, The teacher tries her best to make the students understand the lecture.,4,5,5,4,5,4,0,0,0,0,0,0,0,1,5
6906,The instructor is fully committed to her subject and really works hard for helping students and making them comfortable and enjoy everything. ,5,5,4,4,5,5,0,0,0,0,0,0,0,0,4
6911,Class activities should be interesting so that students want to attend the class.,4,4,3,2,3,3,0,0,0,1,0,0,0,1,2
6912,She wants us to be confident and tells us not to be scared of the test.,5,5,5,4,5,3,0,0,0,1,0,0,0,0,4
6914,Instructor should give more practice in listening.,5,4,4,4,5,5,0,0,0,0,0,0,0,1,3
6915,The instructor should take some tests according the test pattern.,5,4,5,4,5,5,0,0,0,0,0,1,0,0,3
6916,"I think the instructor should focus more on testing as well because our small problems in English ( like grammar)are because of the lack of practice because ""Practice makes a man perfect"" ",4,4,3,5,4,4,0,0,0,0,0,0,0,0,3
6926,There is no book which I like the most. The instructor is too good at delivering his point without the book. The methodology is easy and comprehensive. And the class environment is very nice. So I really like the whole course.,4,5,5,5,4,4,5,0,1,1,0,0,0,1,5
6928, Teacher should give the chance of answering question to every student and not to some particular students.,4,5,4,5,4,4,4,0,0,0,0,0,0,1,1
6929,The number of assignments should be lessened.,4,5,5,4,4,5,5,0,0,0,0,0,0,0,3
6931,Course book work should be included so that we know about exams topic.,3,5,4,3,4,5,4,0,0,0,0,1,0,0,3
6932,"Although his method is right, but at this time I am not able to understand him.",1,5,4,4,3,4,2,0,0,1,0,0,0,1,3
6934,He  relates every problem with real world problems.,4,5,5,5,5,4,5,0,0,0,1,0,0,0,5
6935,The instructor's method and grip on teaching is very excellent.,5,5,5,5,5,5,4,0,1,0,0,0,0,1,5
6945,The instructor is really cooperative and also gives extra time to the students who are facing problems.,5,5,5,5,5,0,0,0,1,1,0,0,0,1,5
6947,The instructor should explain things more clearly rather than just giving a hint. ,5,3,2,4,4,0,0,0,0,0,0,0,0,1,2
6948,The instructor should teach briefly.,4,4,4,4,4,0,0,0,0,0,0,0,0,1,3
6949,Everything is good.,4,4,5,4,4,4,0,1,1,1,1,1,1,1,4
6951,Lab-Instructor is very co-operative and has a very good method to deliver knowledge.,5,4,4,4,4,0,0,0,0,0,0,0,1,1,5
6955,He pays attention to all students.,4,4,4,4,4,0,0,0,0,0,0,0,0,0,4
6965,The method of teaching is quite boring. ,5,5,3,4,4,5,3,0,0,0,0,0,0,1,2
6966,The teacher should tell more about the test pattern of the mid term and the class test and should give a brief information about how to solve or attempt the course. ,5,5,4,4,4,5,4,0,0,0,0,0,0,0,3
6968,The instructor should be more elaborative in delivering the lecture.,5,4,4,4,5,4,5,0,0,0,0,0,0,1,3
6968,"Tries his best, but not best enough",5,4,4,4,5,4,5,1,1,1,1,1,1,1,4
6970,"If  we can not understand a topic, he repeats this topic.",4,4,4,4,4,4,3,0,0,0,0,0,0,1,4
6972,Instructor needs to improve delivery method and needs to clarify the basic concepts of all the students.,5,4,3,3,4,5,3,0,0,0,0,0,0,1,2
6974,The instructor relates every problem with real world problem.,4,4,4,5,4,5,3,0,0,0,1,0,0,0,5
6975,Class environment should be energetic and mode of teaching should be changed. Sir needs to use mic for sound.,5,5,4,4,5,5,3,0,0,0,0,0,0,1,2
6976,Grip and method to teach the theory is very strong.,5,4,4,4,5,5,4,0,1,0,0,0,0,1,5
6985,He's quite friendly which produces a healthy environment to perform work.,5,4,4,4,5,0,0,0,0,0,0,0,0,1,4
6986,Everything is best.,5,5,5,5,5,0,0,1,1,1,1,1,1,1,5
6987,The instructor is friendly and helps in performing the experiment.,5,5,4,4,5,0,0,0,0,0,0,0,1,1,4
6988,He helps every student in performing experiments.,4,4,4,4,4,0,0,0,0,0,0,0,1,0,4
6993,He should give some examples from real world regarding the use of practicals. ,3,5,5,4,4,0,0,0,0,0,1,0,0,0,3
6994,He comes to students for help.,3,3,3,3,2,0,0,0,0,0,0,0,0,0,3
6996,Grip and method to teach is excellent.,5,5,5,5,4,0,0,0,1,0,0,0,0,1,5
7009,Assignments should be lessened.,5,4,4,4,4,5,0,0,0,0,0,0,0,0,2
7010,I have no idea about this subject and I am scared of this subject.,3,3,1,4,3,2,0,0,0,1,0,0,0,1,1
7011,Instructors need to be sure that all class has learned or not and kindly think about social science.,4,3,2,3,3,2,0,0,0,0,0,0,0,1,2
7014,"When he teaches his group, he should inform students. ",4,4,4,4,4,4,0,1,0,0,0,0,0,0,3
7015,Assignments should be least because we have short time. ,4,4,3,3,4,4,0,0,0,0,0,0,0,0,2
7024,Less assignments should be given so we can focus on other subjects too.,3,4,5,5,5,4,0,0,0,0,0,0,0,0,3
7026,"Should make this course more interactive so that students are attracted towards it, and keep things simple in the beginning.",4,4,3,5,3,5,0,0,0,1,0,0,0,0,3
7028,TEACHING METHOD IS NICE.,4,5,5,4,4,5,0,0,0,0,0,0,0,1,4
7029,Assignments should be minimum.,5,5,5,4,5,5,0,0,0,0,0,0,0,0,3
7030,Instructor needs to give us short readings and needs to give us Urdu version of the readings.,4,3,2,2,2,2,0,0,0,0,0,0,0,0,3
7031,"At this time I am not satisfied with anything although he is a good teacher, but at this time, he is not able to teach me perfectly.",4,5,3,4,4,2,0,0,1,0,0,0,0,1,2
7033,He should give us short and understandable readings.,4,4,4,5,4,5,0,0,0,0,0,0,0,0,3
7034,1 class is not enough for dry subject. we can not understand it by reading but when teacher explains it makes sense,4,5,4,4,4,4,0,0,1,0,0,0,0,1,4
7034,"1 class is not enough for dry subject. We can not understand it by reading but when teacher explains, it makes sense.",4,5,4,4,4,4,0,0,0,0,0,0,0,1,5
7035,Assignments should be minimum or time should be maximum.,4,4,4,5,4,5,0,0,0,0,0,0,0,0,2
7036,Grip and method to teach is very good.,5,5,5,5,5,5,0,0,1,0,0,0,0,1,5
7045,She throws some unique ideas.,3,4,5,4,4,5,0,0,0,1,1,0,0,1,5
7050,"Instructor needs to be co-operative with all the students, must give respect to every student and needs to answer all the questions with patience. ",2,3,2,2,2,3,0,0,0,0,0,0,0,1,2
7051,module don't like but instructor like,4,4,5,4,4,4,0,0,1,1,0,0,0,1,3
7052,She is a good teacher but I am not able to understand her.,2,4,2,4,4,2,0,0,1,0,0,0,0,1,2
7053,She should allow students to speak.,2,2,3,2,3,2,0,0,0,0,0,0,0,1,2
7055,"Something about Islam should be seen in arts as well because first of all, we should be concerned about our religion(Islam), then understand other religions. It is because most of our youth does not know what Islam says; then our society will focus on Islamic teachings and we will not die without known Islam and we will face Allah on the day of judgment knowing that we have known a lot about our religion.",1,4,3,3,4,4,0,0,0,0,0,0,0,0,3
7056,Grip and method to teach is very strong.,5,5,5,5,5,5,0,0,1,0,0,0,0,1,5
7064,I love graphs.,4,5,5,4,5,4,0,0,0,1,0,0,0,1,5
7065, Class is much boring. It should not be so. We should have some assignments for home. The quiz or mid term should be less in the course.,4,3,4,3,4,4,0,0,0,1,0,1,0,1,1
7066,She should slow down her teaching speed.,4,4,4,3,4,3,0,0,0,0,0,0,0,1,2
7068,Everything is good till now.,5,3,4,3,4,4,0,1,1,1,1,1,1,1,4
7070,Students should be involved in class.,3,4,4,3,3,3,0,0,0,1,0,0,0,1,2
7071,"Speed should be slowed down. A page should be developed where the topics covered on daily basis can be posted like what happens on wiki spaces.
The instructor should give home work on daily basis. ",5,4,4,3,4,5,0,0,0,1,0,0,0,1,2
7072,"She is cooperative. If someone doesn't understand something, she helps them fully and revises the  previous work.",4,4,4,4,5,5,0,0,0,0,0,0,0,1,4
7074,Our instructor is very good. She teaches us very nicely. She has full grip on her subject. I think we have gained much from her.,4,5,4,4,4,5,0,0,1,1,0,0,0,1,5
7078,She is very much cooperative.,4,4,5,4,4,5,0,0,0,0,0,0,1,1,5
7079,Everything is going on well.,5,5,4,4,4,4,0,1,1,1,1,1,1,1,4
7080,"The instructor is very hard working, but she teaches us so much in class that  I find it very difficult to get it all. I understand  what  she teaches us.",4,5,5,4,4,3,0,0,1,0,0,0,0,1,4
7081,The teacher does not mention the chapter in lecture which is delivered in every class. You have to ask every time. ,4,4,4,4,4,4,0,0,0,0,0,0,0,0,3
7090,He has not taught us anything until now.,4,2,3,3,3,3,0,0,1,0,0,0,0,1,1
7091,All the teachers of this module are always available for explaining and elaborating the topics.,5,4,4,4,3,4,0,1,0,0,0,0,0,1,4
7092,The instructor has a bit of hesitation confronting students.,5,5,5,5,5,5,0,0,0,0,0,0,0,1,3
7097,Almost perfect!,4,4,3,3,4,4,0,1,1,1,1,1,1,1,5
7099,"The outline of the course should be explained. The result demanded by us after the course should be explained. 
An explanation is required on what is Social Science is. ",5,3,3,4,2,4,0,0,0,1,0,1,0,1,1
7102,He is a very chilled person and a nice guy.,4,4,4,4,4,4,0,0,0,0,0,0,0,0,4
7103,The module is going boring but the instructor is excellent.,4,5,5,5,5,5,0,0,0,1,0,0,0,1,3
7104,Confidence level of most of the students is very low. The instructors should mange  a method so that every one can come out to stage.,4,4,4,4,4,4,0,0,0,0,0,0,0,1,2
7105,I like his hard work and his method of instruction. ,5,5,5,5,4,5,0,0,0,0,0,1,0,1,4
7113,"He teaches with the enthusiastic face, I love it, as it gives me the motivation I require. :)",5,5,3,5,5,4,0,0,0,1,0,0,0,1,4
7113,He teaches with an enthusiastic face; I love it as it gives me the motivation I require. :),5,5,3,5,5,4,0,0,0,1,0,0,0,1,5
7115,"The instructor should encourage us for speaking more, should increase our vocabulary and should focus on our pronunciation.",3,5,4,4,4,4,0,0,0,0,0,0,0,1,3
7118,He encourages us and cooperates with us greatly.,4,5,4,5,4,4,0,0,0,0,0,0,0,1,5
7119,Sir should explain that what we have to do in the module. I mean we are studying something every day and we don't know the syllabus the course the pattern of exam,4,5,5,3,4,4,0,0,0,1,0,1,0,1,2
7119,"Sir should explain what we have to do in the module. I mean we are studying something every day and we don't know the syllabus, the course, and the pattern of the exam.",4,5,5,3,4,4,0,0,0,0,0,1,0,1,2
7120, I want to be an English man.,5,5,5,3,3,5,0,0,0,1,0,0,0,1,5
7121,He is a very good instructor. He is perfect.,5,5,4,5,4,4,0,0,0,0,0,0,0,1,5
7123,His method of teaching and motivation is excellent.,4,5,5,5,5,5,0,0,0,1,0,0,0,1,5
7124,The instructor encourages students to speak.,3,4,5,3,3,5,0,0,0,0,0,0,0,1,4
7126,I understand almost all the things we which studied in our class but there is a little bit confusion in my Grammar part. So I am hoping for best from my instructor and myself.,5,5,4,4,4,5,0,0,1,1,0,0,0,1,5
7127,The instructor pronounces words in a very beautiful way. His way of teaching is excellent.,5,5,5,5,5,5,0,0,0,0,0,0,0,1,5
7129,"I like sir's method, he prepares us according to the test.",5,5,5,4,5,5,0,0,0,0,0,1,0,1,4
7129,I like sir's method that he prepares us according to the test.,5,5,5,4,5,5,0,0,0,0,0,1,0,1,4
7138,"The instructor should deliver us the topic in the form of summary and not give too much story before that. He should teach more on all days
as on some days, we learn just 1 or 2 points.",2,4,4,3,4,4,4,0,0,0,0,0,0,1,2
7138,"Should deliver us the topic in the form of summary, not too many stories before that. Some days we just learn 1 or 2 points",2,4,4,3,4,4,4,0,0,0,0,0,0,1,3
7139,The instructor's way of teaching is different. We don't get bored. ,4,5,3,4,4,4,4,0,0,1,0,0,0,1,4
7140,"The instructor should not just focus on the students who speak loud in the class: everyone is different from each other; if someone does not speak in the class, it does not mean that he is not equal to other students. Please take everyone with you and forget about the brownie points. Thank you.",3,4,4,4,4,4,4,0,0,0,0,0,0,1,2
7142,We should have some idea about the work that we are going to do but we do not know at the end of slot what  we have done.  There should be remarks on our done work whether  we have done it right or not.,3,5,4,4,4,3,3,0,0,0,0,0,0,1,2
7144,"Awesome work, sir! :)",2,5,4,5,5,3,5,1,1,1,1,1,1,1,5
7145,He is an excellent teacher but I think he should be more friendly with the students  so that they don't hesitate while sharing their problems and understandings.,4,5,5,5,5,5,4,0,0,0,0,0,1,1,4
7146,I think he should deliver his lecture more precisely for those students who have not much knowledge about the field. He should involve all the students in his lecture.,4,4,4,4,4,4,3,0,0,1,0,0,0,1,2
7147,I do not understand all topics except lab.,5,5,3,3,4,5,2,0,0,0,0,0,0,1,1
7149,Sir gives assignments and doesn't give much time. Dead line for submission of assignments must be longer.,5,5,5,5,5,4,4,0,0,0,0,0,0,0,3
7150,"Most of the students have come from backward areas and they have not studied in good, private schools so their level  is low. If sir teaches at the low level, then every one will be able to understand him easily.",4,5,4,4,5,4,4,0,0,0,0,0,0,1,3
7151,The teacher should tell us what to study in next class.,4,5,5,5,5,4,5,0,0,0,0,1,0,1,3
7160,He explains quite good and helps in difficulties.,5,5,5,4,5,0,0,0,0,0,0,0,1,1,4
7162,He should tell us more about the assignments as the lab work is far easier than the assignments.,4,5,5,4,3,0,0,0,0,0,0,0,1,1,2
7167,He must elaborate what we have to do and lab assignments must be explained first.,3,5,3,4,3,0,0,0,0,0,0,0,1,1,2
7169,Some more instructions should be given.,4,4,4,4,4,0,0,0,0,0,0,0,0,1,4
7174,"The condition of the computers is very poor: you have to change 2 to 3 computers daily if you are working in lab because of software issues like flash player, Browsers and mostly internet is not working etc. The instructor is excellent.",4,4,5,4,5,0,0,0,0,0,0,0,1,1,3
7175,He is available every where and helps us very much.,5,5,5,5,5,0,0,1,0,0,0,0,0,0,4
7186,Students should be involved in class because environment becomes boring sometimes.,5,4,5,3,4,4,5,0,0,0,0,0,0,1,4
7188,Ability to attract the attention of students lacks somehow; most students get lazy during the lecture.,5,4,4,5,5,5,4,0,0,1,0,0,0,1,1
7190,He is very good at Physics. He is a very nice man. He is always available outside the class. ,5,4,4,4,5,5,4,1,1,0,0,0,0,0,4
7191,I think the instructor is calm and tells us all about our subject. He is very cooperative.,4,4,4,4,4,4,3,0,1,0,0,0,0,1,4
7192,Sir should give lecture in a loud voice.,4,4,4,4,5,4,4,0,0,0,0,0,0,1,3
7198,The way of teaching in not good. He is trying hard to convey the message but he can't.,4,4,5,2,5,4,3,0,1,0,0,0,0,1,2
7198,The way of teaching in not good. He tries hard to convey the message but he can't.,4,4,5,2,5,4,3,0,0,0,0,0,0,1,2
7199,Sir's method is a little boring.,5,5,5,5,5,5,4,0,0,0,0,0,0,1,2
7213,His coordination and frankness are very good.,5,5,5,5,5,0,0,0,0,0,0,0,0,1,4
7217,THE INSTRUCTOR IS GOOD AT SOLVING PROBLEMS.,4,4,5,5,5,0,0,0,1,0,0,0,0,0,4
7219,"Stop laughing with students. Be a teacher, Sir, not a class fellow. :/",1,3,4,4,4,0,0,0,0,0,0,0,0,0,2
7222,The instructor's way of teaching is better.,4,5,5,5,5,0,0,0,0,0,0,0,0,1,4
7232,The instructor literally knows the insight of a student!,5,5,5,5,5,5,0,0,0,0,0,0,0,1,5
7233,"The instructor should not be so serious, should mark our assignment in a lenient way,  not just strictly that breaks our hearts.
Some people got more marks than me although their assignments were not better than mine, but their assignments are checked by madam.
So, please, he should give us marks for our motivation.",3,5,3,3,3,4,0,0,0,1,0,0,0,1,2
7236,Philosophy shouldn't be a part of syllabus.,5,5,5,3,3,4,0,0,0,0,0,0,0,0,2
7262,what is the purpose of this course I couldn't understand,3,3,3,3,3,3,0,0,0,1,0,0,0,1,1
7300,She need to grip the attention of students as it usually gets kind of boring.,5,3,4,3,3,3,0,0,0,0,0,0,0,1,2
7306,I am totally satisfied by Madam.,5,5,5,5,5,5,0,0,0,0,0,0,0,1,5
7362,I can perform well after these classes.,2,2,4,3,4,1,0,0,0,0,0,0,0,0,4
7564,Class time is too much and to be honest the course outline is quite boring too. We still have no idea about why are we studying this module.,4,4,2,3,3,4,0,0,0,1,0,1,0,0,2
7573,Come up with new activities in class.,5,4,4,3,3,3,0,0,0,0,0,0,0,1,2
