Row ID ,Comment,Aspect Ranks,,,,,,,Aspects,,,,,,,Sentiment
3742,He should deliver the lecture in a simple way. Most of the times it becomes bit complicated. He did not follow the course outline. There is no specific source for material.,3,4,3,2,4,3,0,0,0,0,0,1,0,1,1
3743,He needs to improve his ability to develop interest in his subject because this module is quite advanced for us and is difficult to grasp.,3,3,2,3,3,2,2,0,0,1,0,0,0,1,1
3743,His ability to develop interest in his subject needs improvement because this module is quite advanced for us and is difficult to grasp.,3,3,2,3,3,2,2,0,0,1,0,0,0,0,2
3744,"Instructors should be prepared for lecture, and he should not be confused during the lecture.",4,2,2,1,3,1,2,0,1,0,0,0,0,1,2
3745,He tries to help everyone in class in any class related problem and he is also very polite.,4,3,2,3,5,2,3,0,0,0,0,0,1,1,5
3746,I can not learn any thing in this module from the instructor. He should leave this module and it will be better for the university.,1,1,1,1,1,1,1,1,1,1,1,1,1,1,1
3747,"It often happens that the instructor forgets the important points of lecture due to lack of preparation for the lecture, so in the end students have to suffer for the instructor's negligence.",3,4,3,2,4,2,4,0,1,0,0,0,0,1,1
3748,"Some points are not cleared by the instructor and most of the time, difficulty is faced in understanding the basic concepts.",4,4,3,4,5,4,2,0,0,0,0,0,0,1,2
3750,Instructor needs to improve his way of clearing up topics to class,4,4,4,4,4,3,3,0,0,0,0,0,0,1,2
3751,Duration of a single lecture is less for understanding all stuff.,4,3,4,4,4,2,4,0,0,0,0,1,0,1,4
3753,"Instructor needs to improve the way of delivery. He is making us suffer while trying to match up with the requirements of the module i.e. I don't know what we are studying. It seems like he is teaching something from middle, or that we do not have the prior knowledge for the course.",3,4,2,2,4,2,2,0,0,0,0,1,0,1,1
3753,"The way of delivery is confusing, he is suffering to match up with the requirements of the module i.e. I don't know what we are studying. It seems like he is teaching something from middle , or we do not have the prior knowledge of the course.",3,4,2,2,4,2,2,0,1,0,0,1,0,1,2
3754,"Sometimes the instructor did not explain the concept clearly, even when he has clear concept in his mind. Delivering method should be improved. I like that he gives extra time after the class",4,3,4,4,4,3,4,1,1,0,0,0,0,0,3
3770,"He teaches nothing, just moves around the room",1,1,1,1,1,0,0,0,1,1,0,0,0,1,1
3772,Strictness should be reduced,4,4,3,4,4,0,0,0,0,0,0,0,0,1,2
3774,"He needs to improve his attitude, ways of teaching and talking to students.",5,1,2,2,1,0,0,0,0,1,0,0,0,1,1
3776,Instructor needs to improve communication skills and preparation of lecture before class,2,1,1,1,1,0,0,0,1,0,0,0,0,1,2
3777,I think the teacher needs to be more interactive and should focus more on the elaboration of the topics,4,3,3,3,3,0,0,0,0,0,0,0,0,1,2
3778,His way of teaching and how he interacts with students all should change. He does not know how to communicate with student facing problems.,3,3,3,4,3,0,0,0,0,0,0,0,1,1,1
3779,"He must have clear ideal about what is he going to teach us, he must not have any confusions.",3,3,2,3,3,0,0,0,1,0,0,0,0,0,2
3781,He should cooperate with the students.,2,2,3,4,3,0,0,0,0,0,0,0,0,1,3
3782,"He needs to improve his way of communication, making problem clear to class, helping students in debugging problems",4,2,2,4,1,2,0,0,0,1,0,0,1,1,1
3783,Instructor doesn't have enough knowledge of the lab experiments and fails to explain the working of experiment to students.  He has poor debugging skills and general knowledge of field.,4,1,1,4,1,1,1,0,1,0,0,0,1,0,1
3784,Sir is so arrogant; from his behavior it seems that he is college Dean. He is not familiar with most of things about tasks that are planned for the lab sessions.,2,3,3,3,2,3,2,0,1,0,0,0,1,1,1
3785,The instructor should try to visit every student during lab to confirm if there is any problem or not.,4,3,3,4,2,0,0,0,0,0,0,0,1,0,1
3785,The instructor should try to visit every student during lab to confirm if there is any problem or not.,4,3,3,4,2,0,0,0,0,0,0,0,1,0,2
3797,He needs to improve his way of teaching and create interest in the lab,5,4,4,3,3,3,0,0,0,0,0,0,1,1,1
3798,I like the calm personality of Instructor. Labs are coherent with class lectures.,4,4,5,4,5,0,0,0,0,0,0,0,1,1,4
3799,"The way he teaches, I like very much",4,4,4,4,4,0,0,0,0,0,0,0,0,1,5
3800,There should be a comprehension before lab so that every student understands the main aim of that lab.,5,5,4,4,4,0,0,0,0,0,0,0,1,0,2
3800,"Needs to improve teaching method, i.e. there should be a comprehension before lab so that every student understands the main aim of that lab. I like that he is very cooperative",5,5,4,4,4,0,0,0,0,0,0,0,1,1,3
3801,"All is good, but sometimes sir hesitates during lectures and we don't understand.",4,4,4,4,4,0,0,0,0,0,0,0,0,1,4
3802,All things must be improved or leave the module.,3,3,3,3,1,0,0,1,1,1,1,1,1,1,1
3803,He needs to improve communication with the student,3,3,4,3,4,0,0,0,0,0,0,0,0,1,2
3804,Lab teacher in the campus are as good as we expected. Steps must be taken to either induct new teachers or train the present ones,5,4,4,4,4,0,0,0,0,0,0,0,1,1,1
3806,Although he has knowledge but the way he delivers is not comfortable.,3,3,4,4,4,0,0,0,1,0,0,0,0,1,2
3807,Co-operative and kind to us,3,2,2,1,1,0,0,0,0,0,0,0,1,1,4
3809,"All we are doing in the labs is practical work without any knowledge of its fundamentals, background and theory. Also the tutor does not have a ability to debug circuit.",4,3,2,4,2,3,0,0,1,0,0,0,1,1,1
3809,I like his flexibility,4,3,2,4,2,3,0,0,0,0,0,0,0,0,4
3810,"The experiments of lab should be changed and improved. Apart from this, students should be made aware about the graded experiments.",5,3,3,4,4,0,0,0,0,0,0,0,1,0,2
3810,He is very jolly,5,3,3,4,4,0,0,0,0,0,0,0,0,1,4
3811,I like his good behavior with students,4,4,3,3,3,0,0,0,0,0,0,0,0,1,4
3812,As strength of students is large so sir faces difficulty to guide every group more than 1 time so there should be a T.A.,4,5,4,4,5,0,0,0,0,0,0,0,1,0,3
3812,Method of teaching is very good.,4,5,4,4,5,0,0,0,0,0,0,0,0,1,5
3813,The instructor generates interest of the students in the topics and tries to satisfy them.,5,5,5,4,5,0,0,0,0,1,1,0,0,1,4
3813,The instructor generates interest of the students in the topics and try to satisfy them,5,5,5,4,5,0,0,0,0,1,0,0,0,1,4
3814,There should be proper coordination between instructor and lab engineer.,3,3,3,3,3,0,0,0,0,0,0,1,1,0,2
3814,There should be proper coordination between instructor and lab engineer.,3,3,3,3,3,0,0,0,0,0,0,0,1,0,2
3829,Needs to improve availability and communication,4,4,3,3,5,4,0,1,0,0,0,0,0,1,2
3838,Needs more interaction and participation with other teachers who are teaching the same course.,5,3,3,3,3,3,3,0,1,1,0,0,0,1,2
3840,"She doesn't interact with the students, so students often hesitate to ask their questions.",3,2,2,3,5,2,0,0,0,0,0,0,0,1,1
3840,"She doesn't interact with the students, so students often hesitate to ask their questions.",3,2,2,3,5,2,0,0,0,0,0,0,0,1,2
3842,Needs to improve communication skills,3,4,3,2,3,3,0,0,0,0,0,0,0,1,2
3843,I told you last time as well that she has no ability to teach the year one. So it will be your kindness if you hand her a resignation letter. Why do you take no action?,1,1,1,1,1,1,1,1,1,1,1,1,1,1,1
3864,She delivers interesting lectures,5,5,5,4,5,5,5,0,0,0,0,0,0,1,4
3869,More participation is required along with other teachers teaching the same course.,4,3,3,3,3,3,3,0,0,0,0,0,0,1,3
3876,"This module has a great effect on my life practically, and now I am able to visualize the positive aspects of every thing. I have managed my time very well.",4,3,3,4,4,4,4,0,0,0,1,0,0,0,5
3895,"Such activities must be included which tend students to concentrate as it was in the lecture of ""Time Management""",4,5,5,4,5,5,0,0,0,1,0,0,0,1,3
3896,Very good teacher with vast experience of the module. Very inspiring for students.,4,5,5,5,5,5,5,0,1,1,0,0,0,1,5
3896,Very good teacher with vast experience of the module. Very inspiring for students,4,5,5,5,5,5,5,0,1,1,0,0,0,1,5
3897,There should be video lectures in the class. His body language and method is very positive and good.,3,5,5,5,4,5,0,0,0,0,0,0,0,1,4
3900,lecture starts boring when instructor gives a long presentation of the topic without involving students.,2,5,3,3,5,3,0,0,0,1,0,0,0,1,1
3904,practice exercises should be in class rather than speaking for the whole slot,4,4,4,4,4,4,4,0,0,0,0,0,0,1,2
3907,Everything he delivers is outstanding .,5,5,5,5,5,5,0,0,0,0,0,0,0,1,5
3908,Making lectures interesting by some activities and relating interesting experiences from his life to the topic is great.,2,4,4,4,4,4,0,0,1,1,1,0,0,1,5
3930,"Co-operative and very interesting lectures, conceptual lectures along with practical problems.",5,5,5,5,5,5,5,0,0,1,1,0,0,1,5
3932,Instructor is so good and has good grip on the module. He is the brilliant teacher of his subject. I am satisfied with the method of teaching.,5,5,5,5,5,5,5,0,1,1,0,0,0,1,5
3934,He should spent more time to prepare for lecture,1,3,3,1,3,4,0,0,0,0,0,0,0,0,2
3936,He is co-cooperative and kind,2,4,4,4,4,4,0,0,0,0,0,0,0,1,4
3937,He should change his way of teaching. I could not easily understand him.,3,3,2,3,4,3,0,0,0,0,0,0,0,1,2
3938,Friendly environment.,2,5,5,4,5,5,0,0,0,0,0,0,0,1,4
3939,Each and every point is quiet cleared in the class with practical examples. The instructor generates interest in class.,5,5,5,5,5,5,0,0,1,1,1,0,0,1,5
3940,Friendly environment in class,3,4,3,2,4,3,0,0,0,0,0,0,0,1,4
3941,there should be some quiz for practice as we have no mid or graded quiz.,5,5,5,5,5,5,0,0,0,0,0,0,0,0,1
3941,Way of teaching is very interesting and clear. We do not feel bored during lectures.,5,5,5,5,5,5,0,0,0,0,0,0,0,1,5
3956,Difficult and unsolved examples from book must be solved in class.,4,5,4,4,5,5,0,0,0,0,0,0,0,1,3
3957,periodic tests should be arranged,4,4,4,4,4,2,4,0,0,0,0,0,0,0,3
3962,there should a tutorial class in a week.,5,5,4,5,5,3,5,0,0,0,0,0,0,0,3
3962,Lectures are interesting and has practical problems solving exercises,5,5,4,5,5,3,5,0,0,0,1,0,0,1,4
3963,Cool natured person and answers all questions,5,5,5,4,5,5,5,0,1,0,0,0,0,1,4
3964,I like the problems discussed in the class,3,4,4,3,3,1,5,0,0,0,1,0,0,0,4
3965,"Needs to improve preparation, give more examples and keep the speed a little slow",4,4,3,3,4,3,4,0,0,0,1,0,0,1,1
3968,"the good thing is that he knows the sort of problems which disturb us, so he himself manages that for us",5,5,5,5,5,5,5,0,1,0,0,0,0,1,4
3968,"The good thing is that he knows the sorts of problems which might disturb, so he himself takes care of them for us",5,5,5,5,5,5,5,0,0,0,0,0,1,1,5
3969,He listens to everyone and teaches at the level of students.,4,4,5,4,5,5,0,0,0,0,0,0,0,1,5
3969,"Time slot is not enough for this course, either he has to increase it or pay more time to a single topic. He listens to everyone.",4,4,5,4,5,5,0,0,0,0,0,0,0,1,5
3970,Teacher is available outside the class and problems are solved in time.,5,5,4,5,5,5,5,1,0,0,1,0,0,0,4
3971,Practice problems in the form of non graded assignments should be given to students. Friendly environment.,4,4,2,4,5,3,4,0,0,0,1,0,0,0,3
3972,We should also be taught how to synthesize circuits along with the analysis part.,5,5,5,5,5,5,5,0,0,0,1,0,0,1,2
3972,"Very good interaction with the students, gives example problems to elaborate concepts. One thing that I think is very good about the instructor is that he nicely prepares and presents things in the class in a systematic way.",5,5,5,5,5,5,5,0,0,0,1,1,0,1,5
3973,He should interact more with students.,3,5,4,5,4,3,5,0,0,0,0,0,0,1,2
3975,Little more problem solving exercises.,4,4,4,4,4,4,4,0,0,0,1,0,0,0,3
3975,A little more problem solving exercises would help.,4,4,4,4,4,4,4,0,0,0,1,0,0,0,4
3986,He is cooperative :),4,4,4,4,4,0,0,0,0,0,0,0,1,0,4
3994,Instructor must be aware of topics covered theoretically and labs must be held accordingly.,4,3,3,4,3,0,0,0,0,0,0,1,1,0,2
4000,Delivery method is just satisfactory and it needs to be improved,5,4,4,4,4,0,0,0,0,0,0,0,0,1,2
4002,"Before performing experiments, a brief background of the experiment and its theory should be explained, so the students have a knowledge of the significance of experiment and related issues. I like his friendly attitude.",4,4,3,4,3,0,0,0,0,0,0,0,1,1,3
4006,The instructor looks confused. He must speak loudly and clearly.,2,3,2,3,3,0,0,0,1,0,0,0,0,1,2
4008,The instructor is very cooperative and fixes the problems which students face.,5,4,5,5,5,0,0,0,0,0,0,0,1,1,4
4023,Needs to improve his grip on the subject,5,5,5,4,5,5,5,0,1,0,0,0,0,0,2
4028,Improve his teaching behavior and method,1,5,5,4,4,5,5,0,0,0,0,0,0,1,1
4029,He could not clearly deliver the lecture.,3,4,5,5,5,4,0,0,0,0,0,0,0,1,2
4034,"Full of knowledge and experience of the practical field, knows what is necessary for students and what is not",4,5,5,5,5,5,5,0,1,1,0,0,0,1,5
4036,He needs to be a little friendly with students. He must spend more time in lab with student.,2,5,4,3,5,3,4,0,0,0,0,0,1,1,1
4037,"Informatory lecture, interesting information.",3,5,5,5,5,5,5,0,0,0,0,0,0,1,4
4039,Instructor is only available during Saturday which creates difficulty for students who need to discuss their relevant problems.,1,5,5,5,5,4,3,1,0,0,0,0,0,0,2
4042,"The instructor generates interest of students in all topics. I feel very good while working with him. His teaching style is impressive. He relates the problems faced in class, with practical life.",2,5,5,5,5,4,5,0,0,1,1,0,0,1,5
4053,He should be polite with class. He behaves just like he is teaching a primary class!,4,5,2,4,4,0,0,0,0,0,0,0,0,1,1
4058,His behavior is very good.,3,3,3,3,3,0,0,0,0,0,0,0,0,0,5
4059,"Teaching method, knowledge of subject and attitude need to be improved.",4,2,2,3,3,0,0,0,1,0,0,0,0,1,1
4060,He should actively interact with students.,4,3,3,4,3,0,0,0,0,0,0,0,0,1,3
4061,Improve teaching style and lack of knowledge,3,2,2,2,2,0,0,0,1,0,0,0,0,1,1
4066,"Improve the way of teaching, creating interest to the module and the topic, knowledge grip on the subject or module.",5,3,4,4,4,0,0,0,1,1,0,0,0,1,1
4067,No special aspect to be liked,3,3,4,3,3,0,0,1,1,1,1,1,1,1,1
4068,"I think the instructor should prepare very  well before getting to class. Most of the times when we ask questions, he wasn't prepared beforehand so it would take him more time.",4,3,2,3,3,0,0,0,1,0,0,0,0,1,2
4072,He knows every thing but he doesn't know how to deliver it,4,3,2,3,2,0,0,0,1,0,0,0,0,1,2
4073,"Instructor is co-operative, and does his best effort for each and every student.",5,4,2,3,3,0,0,0,0,0,0,0,1,1,5
4074,He is very good but he should have a grip on the subject,4,3,3,3,3,0,0,0,1,0,0,0,0,0,3
4086,"His way of teaching is not satisfactory. Things that are related to ""how it should be done"" must be practically performed. He just writes it on board which always goes over our heads.",5,4,3,3,5,5,2,0,0,1,0,0,1,1,5
4087,Shouldn't be aggressive,4,2,3,1,4,4,4,0,0,0,0,0,0,0,1
4089,He should use multimedia projector to deliver his lectures.,3,5,4,3,5,4,4,0,0,0,0,0,0,1,3
4090,He has friendly behavior and is regular,5,4,2,1,4,5,5,1,0,0,0,0,0,1,4
4091,According to my opinion the instructor gives his best effort in teaching. He explains every thing very well.,4,5,5,5,5,5,5,0,1,0,0,0,0,1,5
4092,He is very hardworking,5,4,3,2,3,5,4,0,0,0,0,0,0,0,5
4093,Sometimes he is unable to clear the concepts as he emphasizes only on the book knowledge.,4,3,3,2,5,5,3,0,1,0,0,1,0,1,3
4094,"He is best, but he should improve his method of teaching.",4,4,5,5,4,5,3,0,1,0,0,0,0,1,3
4095,"He should try to develop our interest in the subject. As we have not done anything practical in it, the course work was pretty boring.",5,4,3,3,4,5,4,0,0,1,1,0,0,1,1
4096,Needs to improve his teaching method,5,3,3,3,3,5,2,0,0,0,0,0,0,1,2
4097,"I like his cooperation with students, ability to generate interest in students about the subject and extra support in understanding the Module",5,5,5,5,5,5,5,0,0,1,0,0,0,1,5
4098,He should stick to the lecture time. He uses up our 15 minutes of break.,5,5,4,5,5,5,5,0,0,0,0,0,0,1,2
4099,"Instructor should teach less or at least normal amount of content in one lecture. He covers too much content in just one slot, and it becomes very  difficult for us to revise or practice it. Therefore, I have problem in understanding almost all the concepts we have studied yet.",4,4,1,3,3,4,2,0,0,0,0,0,0,1,1
4100,He keeps each and every student involved in the lecture. He is very sincere with students. We are happy with him.,5,5,5,4,5,5,4,0,0,1,0,0,1,1,5
4101,He is unable to clear concept from basic level.,5,3,3,3,3,4,3,0,1,0,0,0,0,1,2
4102,He is very cooperative and helps each student individually for any problem regarding lab session or assessments. Best part is that he pays attention to each and every student in lab or class and help them without disappointing and degrading him.,5,4,4,4,5,5,5,0,0,0,0,0,1,1,5
4103,He is a hard working person and tries his best to teach as good as possible.,5,5,4,3,4,5,5,0,0,0,0,0,0,1,4
4104,"He searches for a student who is not putting enough effort in the subject, makes him realize it and encourages him to work.",5,4,4,4,3,5,4,0,0,1,0,0,0,1,5
4105,He is easily accessible outside the class and has friendly behavior.,5,4,5,4,4,5,4,1,0,0,0,0,0,1,4
4116,His way of teaching and respect for students are excellent qualities.,5,5,5,4,5,3,5,0,0,0,0,0,0,1,5
4117,"He is co-operative, has good manners and is friendly.",3,5,4,5,5,5,0,0,0,0,0,0,0,1,4
4118,Friendly behavior and no favoritism.,4,5,5,1,5,5,0,0,0,0,0,0,0,1,4
4119,Involves everyone in the topic's discussions. Friendly.,4,5,5,5,5,5,5,0,0,0,0,0,0,1,4
4120,His knowledge about this field is very strong.,4,5,4,4,5,1,5,0,1,0,0,0,0,0,5
4129,"He prepares lecture before coming to class, very well. He always entertains our questions. He is a very good teacher.",5,5,3,3,4,5,4,0,1,0,0,0,1,1,5
4130,He prepares his lecture very well.,4,5,4,4,5,5,0,0,1,0,0,0,0,1,4
4131,A good teacher tries to clear each and every topic,4,3,4,3,4,4,0,0,0,0,0,0,0,1,4
4132,"The topics we are studying these days are very tough. So, if the teacher could spend some more time on it with us, it would be great.",4,5,4,4,3,4,3,0,0,0,0,0,0,0,3
4133,Teaching Method is awesome. He prepares every lecture very well. His behavior is very good.,4,5,5,4,5,1,5,0,1,0,0,0,0,1,5
4134,His teaching Method is very good.,4,5,5,4,5,4,0,0,0,0,0,0,0,1,5
4135,He should improve his content delivering speed.,4,5,5,3,4,5,0,0,0,0,0,0,0,1,2
4138,cooperative and polite to every student.,3,4,4,4,4,4,0,0,0,0,0,0,0,1,4
4139,Knowledge of the subject is excellent .,4,5,4,3,4,5,4,0,1,0,0,0,0,0,5
4154,He delivers his lectures slowly,5,5,5,4,5,5,5,0,0,0,0,1,0,1,3
4156,"He is a good teacher, has a good command over the subject and most importantly builds interest of the subject in students.",3,5,5,4,4,4,4,0,1,1,0,0,0,1,5
4157,He has strong grip on the subject. He tries his best to clear our concepts.,4,5,5,5,5,5,5,0,1,0,0,0,0,1,5
4158,His knowledge and concepts on the topic are very clear and he makes everything easily understandable.,5,5,5,5,5,2,5,0,1,0,0,0,0,1,5
4160,Teacher's knowledge is very good. He delivers lecture very well.,5,5,4,2,4,3,4,0,1,0,0,0,0,1,5
4161,His teaching method is very good. His behavior is very good. He prepares every lecture very well. He is a very good teacher.,4,5,5,4,5,5,5,0,1,0,0,0,0,1,5
4162,He explains everything,3,4,4,3,4,2,4,0,0,0,0,0,0,1,4
4163,All is well,5,5,5,5,5,5,5,1,1,1,1,1,1,1,4
4164,He integrates things very well and produces a good coherence between the topics.,4,5,4,5,5,3,4,0,1,1,1,0,0,1,5
4165,"We are very new to this subject so it needs to be taught in very slow speed. Also, if the instructor could give us resources like articles and tutorials on the topic we have studied in class, it would be great.",4,5,4,4,4,5,3,0,0,0,0,1,0,1,1
4166,He delivers lecture in a sequence according to topics.,5,4,5,5,5,3,5,0,0,0,0,1,0,0,3
4182,"Practical work should be improved, and his teaching method should also be improved",3,3,3,3,2,0,0,0,0,0,1,0,0,1,2
4184,He needs to be more clear and precise,2,3,2,3,2,0,0,0,0,0,0,0,0,1,3
4189,"Teaching method, making interest in the module needs to improve",3,3,2,2,2,0,0,0,0,1,0,0,0,1,2
4191,Delivery method is poor,4,4,3,4,4,0,0,0,0,0,0,0,0,1,1
4193,"Teaching method, attitude and knowledge of subject needs to improve",3,3,1,3,2,0,0,0,1,0,0,0,0,1,1
4195,I like his regularity,4,3,2,2,4,0,0,1,0,0,0,0,0,0,4
4196,He is friendly,3,2,1,2,1,0,0,0,0,0,0,0,0,0,4
4197,Needs to improve communication skills,4,3,1,3,1,0,0,0,0,0,0,0,0,1,2
4198,"He should try to make things clear rather than making them more vague. Since we are doing practical work in lab, therefore things should be explained in practical manner.",4,3,2,4,3,0,0,0,0,0,1,0,1,1,1
4199,"He teaches as if he is teaching himself. That is not the method of teaching really. He just tries to be over smart in class but the art to deliver knowledge is totally absent out there. Therefore, he should prepare very well before going to a class and teaching complex concepts. He just skims through the top of every topic. We are not able to understand the detail of any concept.",3,2,1,1,1,0,0,0,1,0,0,0,0,1,1
4201,"He should consider the whole class while delivering the lecture. He should take care that every student is getting the point delivered in class, and also listen to him attentively and check if he has performed the given tasks correctly, instead of just giving questions upon questions and getting responses only from just a few students.",3,4,3,3,2,0,0,0,0,0,0,0,1,1,1
4213,All is well.,5,5,5,5,5,5,5,1,1,1,1,1,1,1,4
4216,Teaching style and grip on the subject he is teaching is good,4,5,4,4,4,4,4,0,1,0,0,0,0,1,4
4217,Improve the instructor's availability outside class.,2,5,4,4,4,4,4,1,0,0,0,0,0,0,2
4218,His teaching method is outstanding. He always tries to clear the concepts.,3,5,5,5,5,5,5,0,1,0,0,0,0,1,5
4219,"He is a good teacher , able to create interest in the course",4,5,5,5,5,5,4,0,1,1,0,0,0,1,4
4220,He is an awesome teacher,5,5,5,5,5,5,5,1,1,1,1,1,1,1,5
4221,His concepts and knowledge on the topics he cover is good,1,5,5,5,5,5,5,0,1,0,0,0,0,0,4
4223,"Good teaching, good behavior and no favoritism",5,5,5,5,5,5,5,0,0,0,0,0,0,1,5
4224,"Very co-operative, and hard working",3,5,5,5,5,5,5,0,0,0,0,0,0,1,4
4225,Polite and cooperative. Helps each and every student during lab session.,2,5,5,5,5,5,5,0,0,0,0,0,1,1,4
4226,His method of teaching is excellent.,3,5,5,4,5,5,5,0,0,0,0,0,0,1,5
4227,He elaborates things well and explain almost every minute detail.,3,5,4,5,4,4,5,0,1,0,0,0,0,1,4
4229,Explain each and every point of lecture.,5,5,5,5,5,5,5,0,0,0,0,0,0,1,4
4230,Friendly and good teaching method,5,5,4,4,4,5,4,0,0,0,0,0,0,1,4
4232,He begins from basic concepts and teaches very thoroughly,4,5,4,4,5,4,4,0,1,0,0,0,0,1,5
4249,"His teaches too many concepts in a lecture and the lectures go over-time. It burdens us very much. So, he must try to balance the load on us.",3,5,3,4,5,0,0,0,0,0,0,1,0,1,1
4250,He is regular and has good grip over content,5,4,4,4,4,0,0,1,1,0,0,0,0,0,4
4251,He needs to improve his involvement with the class and course,3,2,2,3,2,0,0,0,0,0,0,1,0,1,1
4252,Communication and teaching method need to be improved. He is hard working and cooperative,4,4,2,4,2,0,0,0,1,0,0,0,0,1,3
4253,He should actively interact with students and check every student to see what they are doing.,4,4,4,4,3,0,0,0,0,0,0,0,1,1,3
4254,Method of delivering lecture needs to improve,3,3,1,3,3,0,0,0,0,0,0,0,0,1,2
4255,I like his friendly behavior and that he is regular,4,3,2,4,2,0,0,1,0,0,0,0,0,1,4
4258,He has friendly behavior easily accessibility. He tries his best to deliver his knowledge.,4,3,3,4,3,0,0,1,1,0,0,0,0,1,5
4259,I like his behavior. He helps a lot when we need him with lab problems,2,3,3,3,3,0,0,0,0,0,0,0,1,0,4
4262,Needs to improve his method of teaching and attitude.,3,3,3,3,3,0,0,0,0,0,0,0,0,1,2
4267,"Be kind, friendly and practical",2,3,3,2,2,0,0,0,0,0,1,0,0,1,1
4282,Needs to improve teaching methodology.,4,5,4,4,5,5,3,0,0,0,0,0,0,1,2
4283,He is not very understandable the first time. He needs to repeat again and again to make things clear.,4,3,5,3,4,3,0,0,0,0,0,0,0,1,2
4285,His knowledge about this course is outstanding,3,5,5,5,5,4,5,0,1,0,0,0,0,0,5
4288,Friendly behavior,4,5,4,4,4,5,5,0,0,0,0,0,0,1,4
4289,Sometimes he cannot convey the message he intended to and that is the most disturbing part of his lecture,4,4,3,3,4,4,3,0,1,0,0,0,0,1,3
4292,Method of teaching is needs to change and he also needs to speak loudly in class,3,4,2,4,3,3,2,0,0,0,0,0,0,1,3
4293,Improve delivery method and behavior with students,5,4,2,2,4,4,3,0,0,0,0,0,0,1,2
4294,He tries hard to make student understand the lecture.,4,5,3,4,4,4,3,0,0,0,0,0,0,0,4
4295,"Easily accessibility, friendly behavior and tries his best to deliver well.",4,4,3,3,4,4,0,1,0,0,0,0,0,1,5
4296,I don't know reason but I feel difficulty in understanding in his lecture,4,3,3,3,4,4,3,0,0,0,0,0,0,1,2
4297,I like his accessibility and that he has good grip of the concepts,3,4,4,4,3,5,4,1,1,0,0,0,0,0,4
4298,"He is regular, friendly and encourages students to ask more question.",3,4,1,3,2,4,2,1,0,0,0,0,0,1,5
4314,All is well,2,4,4,3,4,4,0,1,1,1,1,1,1,1,4
4321,He's good,4,3,3,4,3,3,3,1,1,1,1,1,1,1,4
4324,He should teach us in a better way.,3,3,3,2,2,3,2,0,0,0,0,0,0,1,2
4327,He should try to have a good interaction with students.,3,5,3,3,4,3,0,0,0,0,0,0,0,1,2
4329,Co-operative,3,5,4,3,4,4,0,0,0,0,0,0,0,1,4
